id,title,genre,imdb_link,plot,poster_path
289,Only You,"Comedy, Romance",tt0110737,"Destiny. Faith (Marisa Tomei) believes that two soul-mates can be united if they find each other. From the Ouija board, she has found the name of her missing half, and it is D-A-M-O-N B-R-A-D-L-E-Y. Later, at the carnival, the fortune teller sees the name Damon Bradley in the Crystal Ball and Faith is convinced. She is told that ""You make your own destiny,...don't wait for it to come to you"", but she is looking for Damon. 14 years later, she is engaged to a dull podiatrist and plans to marry until she gets a call from one of his classmates who is on his way to Venice, Italy. The classmate is Damon Bradley. Rushing to the airport to see her soul-mate, she misses him and the plane, but decides, then and there, to go after him. So Faith and her sister-in-law Kate both board the next plane for Italy hoping to find her Damon.",data/posters/289-only-you.jpeg
290,Once Were Warriors,"Crime, Drama",tt0110729,"Set in urban Auckland (New Zealand) this movie tells the story of the Heke family. Jake Heke is a violent man who beats his wife frequently when drunk, and yet obviously loves both her and his family. The movie follows a period of several weeks in the family's life showing Jake's frequent outburst of violence and the effect that this has on his family. The youngest son is in trouble with the police and may be put into a foster home while the elder son is about to join a street gang. Jake's daughter has her own serious problems which are a key element in the plot.",data/posters/290-once-were-warriors.jpeg
291,Poison Ivy II,"Drama, Thriller",tt0114151,Lily is a sheltered art student from Michigan going to school in California. She finds an apartment and her roommates aren't quite normal. One day she finds a box of items belonging to a girl she's never met before. But in the box are nude pictures of the girl and her diary. Lily begins reading the diary and realizes that she's going to change her life and become a wild woman! She begins dating a guy and at the same time her art instructor begins to lust after her. The struggle begins when her boyfriend thinks she's unfaithful to him and her art teacher becomes obsessed.,data/posters/291-poison-ivy-ii.jpeg
292,Outbreak,"Action, Drama, Thriller",tt0114069,"In July of 1967, In Motaba River Valley, Zaire, a virus with a 100% mortality rate starts infecting people. The virus becomes known as the Motaba virus, and it's so deadly that it causes severe bleeding and liquefies internal organs, killing within 3 days. The virus wipes out Motaba River Valley, and a devastatingly huge fire bomb is dropped onto Motaba River Valley in order to reduce the chances of further infection. The bomb was dropped on the orders of corrupt General Donald McClintock, even though an army surgeon, General Bill Ford, was against the idea. 27 years later, in 1994, there is another outbreak in Motaba River Valley. At the United States Army Medical Research Institute of Infectious Diseases (USAMRIID), located at Fort Detrick in Maryland, Colonel Sam Daniels is doing research on the Motaba virus, and so is his ex-wife Roberta Keough, who works at the Center for Disease Control and Prevention (CDC) in Atlanta, Georgia. A monkey carrying the Motaba virus stows away on a ship that is heading for the USA, and after the monkey's arrival, people in Cedar Creek, California start becoming infected by the virus. Sam and Roberta head into Cedar Creek with fellow doctor Casey Schuler, and they start searching for the monkey, thinking that the monkey is the key to finding a cure. Along the way, Sam stumbles onto some information that may be of help -- McClintock has been concealing vital information from the president of the United States. Since 1967, McClintock and Ford have been in possession of E-1101, a serum that was made to cure the virus. McClintock has been trying to stop Ford from coming forward with this information, and so far, McClintock has succeeded. McClintock now wants to drop onto Cedar Creek the kind of firebomb that was dropped on Motaba River Valley 27 years ago. Sam and Roberta figure out that the virus in the Cedar Creek outbreak is a new strain of the Motaba virus -- an airborne strain that is even more contagious than the flu. When a new serum is made to stop the new strain, Sam and Roberta set out to stop McClintock from having the town blown up.",data/posters/292-outbreak.jpeg
293,Léon: The Professional,"Action, Crime, Drama, Thriller",tt0110413,"After her father, mother, older sister and little brother are killed by her father's employers, the 12-year-old daughter of an abject drug dealer is forced to take refuge in the apartment of a professional hitman who at her request teaches her the methods of his job so she can take her revenge on the corrupt DEA agent who ruined her life by killing her beloved brother.",data/posters/293-léon-the-professional.jpeg
294,The Perez Family,"Comedy, Romance, Drama",tt0114113,"In an attempt to secure a sponsor, an unlikely group of Cuban refugees become a ""family"" as the U.S. Immigration and Naturalization Service gives families priority over others. In the process, a political prisoner who hasn't seen his wife for twenty years and a disaffected sugarcane cutter fall in love. An excitable brother and a lovestruck cop contribute to the general confusion. The inevitable humorous romantic entaglements ensue as a final confrontation is set up.",data/posters/294-the-perez-family.jpeg
295,A Pyromaniac's Love Story,"Comedy, Romance",tt0114210,"A pastry boy and the son of a hair-piece mogul become involved in an arson scandal. Sergio is offered a bribe in exchange for taking the blame for the fire that destroys his workplace. Garet, the real arsonist, is apalled that someone else would try to take credit for his act of love. Before long, Sergio and Garet become entangled in a zany love-quadrangle involving Hattie and Stephanie.",data/posters/295-a-pyromaniacs-love-story.jpeg
296,Pulp Fiction,"Crime, Drama",tt0110912,"Jules Winnfield (Samuel L. Jackson) and Vincent Vega (John Travolta) are two hit men who are out to retrieve a suitcase stolen from their employer, mob boss Marsellus Wallace (Ving Rhames). Wallace has also asked Vincent to take his wife Mia (Uma Thurman) out a few days later when Wallace himself will be out of town. Butch Coolidge (Bruce Willis) is an aging boxer who is paid by Wallace to lose his fight. The lives of these seemingly unrelated people are woven together comprising of a series of funny, bizarre and uncalled-for incidents.",data/posters/296-pulp-fiction.jpeg
298,Pushing Hands,"Comedy, Drama",tt0105652,"Master Chu, a retired Chinese Tai-Chi master, moves to Westchester, New York to live with his son Alex, his American daughter-in-law Martha, and their son Jeremy. However, Martha's second novel is suffering from severe writers' block brought on by Chu's presence in the house. Alex must struggle to keep his family together as he battles an inner conflict between cultural tradition and his modern American lifestlye.",data/posters/298-pushing-hands.jpeg
299,Priest,"Drama, Romance",tt0110889,"Father Greg Pilkington (Linus Roache) is torn between his call as a conservative Catholic priest and his secret life as a homosexual with a gay lover, frowned upon by the Church. Upon hearing the confession of a young girl of her incestuous father, Greg enters an intensely emotional spiritual struggle deciding between choosing morals over religion and one life over another.",data/posters/299-priest.jpeg
300,Quiz Show,"Biography, Drama, History",tt0110932,"An idealistic young lawyer working for a Congressional subcommittee in the late 1950s discovers that TV quiz shows are being fixed. His investigation focuses on two contestants on the show ""Twenty-One"": Herbert Stempel, a brash working-class Jew from Queens, and Charles Van Doren, the patrician scion of one of America's leading literary families. Based on a true story.",data/posters/300-quiz-show.jpeg
301,Picture Bride,"Drama, Romance",tt0114129,"The story of 16-year-old Riyo who journeys to Hawaii in 1918 to marry a man she has never met, except through photographs and letters they have exchanged. Hoping to escape a troubled past and to start anew, Riyo is bitterly disappointed upon her arrival: her husband is twice her age and Hawaii is not the paradise she expected. As Riyo comes to terms with her new home, she discovers a land full of hardship, struggle--and unexpected joy.",data/posters/301-picture-bride.jpeg
302,Queen Margot,"Biography, Drama, History, Romance",tt0110963,"The night of August 24, 1572, is known as the Massacre of St. Bartholomew. In France a religious war is raging. In order to impose peace a forced wedding is arranged between Margot de Valois, sister of the immature Catholic King Charles IX, and the Hugenot King Henri of Navarre. Catherine of Medici maintains her behind-the-scenes power by ordering assaults, poisonings, and instigations to incest.",data/posters/302-queen-margot.jpeg
303,The Quick and the Dead,"Action, Romance, Thriller, Western",tt0114214,"Ellen, an unknown female gunslinger rides into a small, dingy and depressing prairie town with a secret as to her reason for showing up. Shortly after her arrival, a local preacher, Cort, is thrown through the saloon doors while townfolk are signing up for a gun competition. The pot is a huge sum of money and the only rule: that you follow the rules of the man that set up the contest, Herod. Herod is also the owner, leader, and ""ruler"" of the town. Seems he's arranged this little gun-show-off so that the preacher (who use to be an outlaw and rode with Herod) will have to fight again. Cort refuses to ever use a gun to kill again and Herod, acknowledging Cort as one of the best, is determined to alter this line of thinking ... even if it gets someone killed ...",data/posters/303-the-quick-and-the-dead.jpeg
304,Roommates,"Comedy, Drama",tt0114296,An elderly yet young-at-heart man moves in with his grandson and both their lives turn upside-down.,data/posters/304-roommates.jpeg
305,Ready to Wear,"Comedy, Drama",tt0110907,"A fashion show in Paris draws the usual bunch of people; designers, reporters, models, magazine editors, photographers. Lots of unconnected stories which all revolve around this show, and an all-star cast.",data/posters/305-ready-to-wear.jpeg
306,Three Colors: Red,"Drama, Mystery, Romance",tt0111495,"Valentine is a young model living in Geneva. Because of a dog she ran over, she meets a retired judge who spies his neighbours' phone calls, not for money but to feed his cynicism. The film is the story of relationships between some human beings, Valentine and the judge, but also other people who may not be aware of the relationship they have with Valentine or/and the old judge. Redemption, forgiveness and compassion...",data/posters/306-three-colors-red.jpeg
307,Three Colors: Blue,"Drama, Music, Mystery, Romance",tt0108394,"The first part of Kieslowski's trilogy on France's national motto: Liberty, Equality, and Fraternity. 'Blue' is the story of Julie who loses her husband, an acclaimed composer and her young daughter in a car accident. The film's theme of liberty is manifested in Julie's attempt to start life anew, free of personal commitments, belongings, grief or love. She intends to numb herself by withdrawing from the world and living completely independently, anonymously and in solitude in the Parisian metropolis. Despite her intentions, people from her former and present life intrude with their own needs. However, the reality created by the people who need and care about her, a surprising discovery and the music around which the film revolves heal Julie and draws her back to the land of the living.",data/posters/307-three-colors-blue.jpeg
308,Three Colors: White,"Comedy, Drama, Romance",tt0111507,"Karol (Polish) marries Domininque (French) and moves to Paris. The marriage breaks down and Dominique divorces Karol, forcing him into the life of a metro beggar and eventually back to Poland. However, he never forgets Dominique and while building a new life for himself in Warsaw he begins to plot...",data/posters/308-three-colors-white.jpeg
310,Rent-a-Kid,"Drama, Family, Comedy",tt0114268,"Harry Habert, owner of a rent office has an original idea: To rent baby's from a nearby orphanage to the local families. He rents the Ward brother's to his first customers...",data/posters/310-rent-a-kid.jpeg
311,Relative Fear,"Drama, Horror, Thriller",tt0110965,Just why are people surrounding Adam Pratman dropping down dead? Is this five year old really a murderous sociopath?,data/posters/311-relative-fear.jpeg
312,Stuart Saves His Family,"Comedy, Drama",tt0114571,"Stuart Smalley, the Saturday Night Live character, comes to the big screen. Stuart, the disciple of the 12 step program, is challenged by lifes injustices. He loses his Public Access Cable Television Show, must beg his manipulative overbearing boss for his job back, rehabilitate his alcoholic father and drug abuser brother, and support his over-weight mother and sister in their lack of ability in handling their relationships with their husbands. Stuart is supported by his 12 step sponsors as a he regresses back to his negative behaviors each time he faces these challenges.",data/posters/312-stuart-saves-his-family.jpeg
313,The Swan Princess,"Animation, Comedy, Family, Fantasy, Musical, Romance",tt0111333,"As children, Prince Derek and Princess Odette are forced to spend their summers together by their widowed parents, who hope that the two will eventually fall in love and marry, so their two kingdoms will be united. As children and adolescents, Derek and Odette can't stand each other, but as young adults they begin to see each other in a different light and fall in love with each other. But one night things take a bad turn when Derek unintentionally offends Odette, who then refuses to marry him if he can't prove that he loves her for who she is and not just her beauty. Odette and her father are then attacked by Lord Rothbart, a vengeful sorcerer who was cast out of William's kingdom when he plotted against the king. In the form of a beast, Rothbart mortally wounds William, and kidnaps Odette then places her under a spell. Now it is up to Derek to rescue Odette by showing his undying love. But will he be in time?",data/posters/313-the-swan-princess.jpeg
314,The Secret of Roan Inish,"Drama, Family, Fantasy",tt0111112,"10-year-old Fiona is sent to live with her grandparents in a small fishing village in Donegal, Ireland. She soon learns the local legend that an ancestor of hers married a Selkie - a seal who can turn into a human. Years earlier, her baby brother washed out to sea in a cradle shaped like a boat; someone in the family believes the boy is being raised by the seals. Then Fiona catches sight of a naked little boy on the abandoned Isle of Roan Inish and takes an active role in uncovering he secret of Roan Inish.",data/posters/314-the-secret-of-roan-inish.jpeg
315,The Specialist,"Action, Drama, Thriller",tt0111255,"Ray Quick is a bomb expert who worked for the CIA along with a guy named Ned Trent, who's extremely demented. When they have a falling out, Ray becomes a freelancer who lives off the grid. A woman named May Munro contacts and wants him to kill the three men who killed her family years ago, who work for the Leon crime family. Ray does it and after killing the first one, the Leons need to find the one who did it and it turns out Ned is now working for them and they task him with finding the bomber. The Leons get him to work with the police and he looks for the bomber. In the meantime Ray, while working on getting the others, can't help but follow May wherever she goes.",data/posters/315-the-specialist.jpeg
316,Stargate,"Action, Adventure, Sci-Fi",tt0111282,"In 1928, in Egypt, a strange device is found by an expedition. In the present days, the outcast linguist Dr. Daniel Jackson is invited by a mysterious woman to decipher an ancient hieroglyph in a military facility. Soon he finds that the device was developed by an advanced civilization and opens a portal to teletransport to another planet. Dr. Jackson is invited to join a military team under the command of Colonel Jonathan 'Jack' O'Neil that will explore the new world. They find a land that recalls Egypt and humans in a primitive culture that worship and are slaves to Ra, the God of the Sun. But soon they discover the secret of the mysterious ""stargate"".",data/posters/316-stargate.jpeg
317,The Santa Clause,"Comedy, Drama, Family, Fantasy",tt0111070,"Divorcee Scott Calvin is disgusted to learn that his ex and her husband have tried - and failed - to break it easy to their 6-year-old son Charlie that Santa isn't real. On Christmas Eve, Scott reads The Night Before Christmas... then receives an unexpected visitor on his roof. When he's startled by Scott's calling out and falls, the Santa impersonator disappears, leaving only an 8-reindeer sleigh and a suit with instructions to put it on if he's involved in an accident. Scott does, and is transported around the town dropping gifts through chimneys until he's taken to the North Pole and informed by a group who claim they're elves that he is now Santa. Charlie is proud of his dad's new job, though Scott's convinced it's a dream. Until his hair turns white, his beard refuses to stay shaved, he gains weight inexplicably, even for his sudden love of junk food... Now he's accepted it, there's just one problem: how to keep it secret from his disbelieving family?",data/posters/317-the-santa-clause.jpeg
318,The Shawshank Redemption,Drama,tt0111161,"Chronicles the experiences of a formerly successful banker as a prisoner in the gloomy jailhouse of Shawshank after being found guilty of a crime he did not commit. The film portrays the man's unique way of dealing with his new, torturous life; along the way he befriends a number of fellow prisoners, most notably a wise long-term inmate named Red.",data/posters/318-the-shawshank-redemption.jpeg
319,Shallow Grave,"Crime, Thriller",tt0111149,"The new flatmate of three preexisting roommates turns up mysteriously dead but in possession of a large sum of money. When the roommates decide to keep it for themselves, their action sets in motion a destructive chain of events that spiral out of control.",data/posters/319-shallow-grave.jpeg
320,Suture,"Drama, Thriller",tt0108260,"Brothers Vincent (rich) and Clay (poor) meet up for the first time after their father's funeral and remark on how similar they look. But unknown to Clay, who thinks his life is taking a turn for the better, Vince is actually plotting to kill him with a car bomb and pass the corpse off as his own, planning to start a new life elsewhere with his father's inheritance. But Clay survives the blast and has his face, memory and identity restored in hospital... but are they the right ones?",data/posters/320-suture.jpeg
321,Strawberry and Chocolate,"Comedy, Drama, Romance",tt0106966,"Diego, a cultivated, homosexual and skeptical young man, falls in love with a young heterosexual communist full of prejudices and doctrinal ideas. First come rejection and suspicion, but also fascination. Fresa y chocolate is a coming-of-age story, told through the development of a great friendship which overcomes incomprehension and intolerance.",data/posters/321-strawberry-and-chocolate.jpeg
322,Swimming with Sharks,"Comedy, Crime",tt0114594,"A young Hollywood executive becomes the assistant to a big time movie producer who is the worst boss imaginable: abusive, abrasive and cruel. But soon things turn around when the young executive kidnaps his boss and visits all the cruelties back on him.",data/posters/322-swimming-with-sharks.jpeg
324,The Sum of Us,"Comedy, Drama",tt0111309,"Set in Sydney, Australia. A (heterosexual) father and his gay son are trying to find Ms/Mr Right respectively. The film shows their relationships with one another and the objects of their affection as tradgedy strikes. There is no overt 'message' in the film, just a very natural, entertaining story-telling.",data/posters/324-the-sum-of-us.jpeg
325,Senior Trip,"Adventure, Comedy",tt0113936,"While on detention, a group of misfits and slackers have to write a letter to the President explaining what is wrong with the education system. There is only one problem, the President loves it! Hence, the group must travel to Washington to meet the Main Man.",data/posters/325-senior-trip.jpeg
326,To Live,"Drama, War",tt0110081,"Fugui and Jiazhen endure tumultuous events in China as their personal fortunes move from wealthy landownership to peasantry. Addicted to gambling, Fugui loses everything. In the years that follow he is pressed into both the nationalist and communist armies, while Jiazhen is forced into menial work. They raise a family and survive, managing ""to live"" from the 40's to the 70's in this epic, but personal, story of life through an amazing period.",data/posters/326-to-live.jpeg
327,Tank Girl,"Action, Comedy, Sci-Fi",tt0114614,"Tank Girl (Rebecca) and her friends are the only remaining citizens living in the wasteland that is Earth, where all the remaining water is controlled by Water and Power, the mega corporation/government that runs the territory. While incarcerated at W + P, Tank Girl and her new friend Jet Girl break out and steal... a tank and a jet. After meeting some mutant kangaroo/humans, and rescuing her little girl (adopted by her friends), the kangaroos and the girls kick Water and Powers' butt.",data/posters/327-tank-girl.jpeg
328,Tales from the Crypt: Demon Knight,"Action, Fantasy, Horror, Thriller",tt0114608,"Brayker is a man who carries the last of seven keys, special containers which held the blood of Christ and were scattered across the universe to prevent the forces of evil from taking over. If The Collector gets the last key, the universe will fall into Chaos, and he has been tracking Brayker all the way to a small inn in a nowhere town. And now the final battle for the universe begins......",data/posters/328-tales-from-the-crypt-demon-knight.jpeg
329,Star Trek: Generations,"Action, Adventure, Mystery, Sci-Fi, Thriller",tt0111280,"In the late 23rd century, the gala maiden voyage of the newly-christened Enterprise-B boasts such luminaries as Pavel Chekov, Montgomery Scott and the legendary Captain James T. Kirk as guests. But her maiden voyage turns into a disaster as the unprepared starship is forced to rescue two transport ships from a mysterious energy ribbon. The Enterprise manages to save a handful of the ships' passengers and barely succeeds out intact... but at the cost of Captain Kirk's life. 78 years later, Captain Jean-Luc Picard and the Enterprise-D crew find themselves at odds with renegade scientist Dr. Tolian Soran... who is destroying entire star systems. Only one man can help Picard stop Soran's scheme... and he has been dead for 78 years.",data/posters/329-star-trek-generations.jpeg
330,Tales from the Hood,"Crime, Drama, Horror, Thriller",tt0114609,"Four short, moralistic horror vignettes (a la EC Comics) that deal with mostly black characters. The framing story introduces three youths out to pick up a drug shipment at a funeral parlor from the strange director, Mr. Simms. As the three punks wind their way through the parlor, Mr. Simms tells them the last stories of some of his more interesting clients.",data/posters/330-tales-from-the-hood.jpeg
331,Tom & Viv,"Biography, Drama, Romance",tt0111454,"In 1915, T.S. (Tom) Eliot and Vivienne Haigh-Wood elope, but her longstanding gynecological and emotional problems disrupt their planned honeymoon. Her father is angry because Tom's poetry doesn't bring in enough to live on, but her mother is happy Viv has found a tender and discreet husband.",data/posters/331-tom--viv.jpeg
332,Village of the Damned,"Horror, Sci-Fi, Thriller",tt0114852,"An American village is visited by some unknown life form which leaves the women of the village pregnant. Nine months later, the babies are born, and they all look normal, but it doesn't take the ""parents"" long to realize that the kids are not human or humane.",data/posters/332-village-of-the-damned.jpeg
333,Tommy Boy,"Adventure, Comedy",tt0114694,"Tommy Callahan Jr. is a slow-witted, clumsy guy who recently graduated college after attending for seven years. His father, Big Tom Callahan, owns an auto parts factory in Ohio. When Tommy arrives back home, he finds he has a position at the factory waiting for him. His dad also introduces Tommy to the new brake pad division of the factory and to Tommy's soon-to-be stepmother, Beverly, and her son Paul. But when Big Tom dies, the factory threatens to go under unless the new brake pads are to be sold. Therefore, Tommy must go on the road to sell them, along with the assistance of Richard, Big Tom's right-hand man. Will Tommy save the company, or will the factory, and the town, go under?",data/posters/333-tommy-boy.jpeg
334,Vanya on 42nd Street,"Comedy, Drama, Romance",tt0111590,"An uniterrupted rehersal of Chekhov's ""Uncle Vanya"" played out by a company of actors. The setting is their run down theater with an unusable stage and crumbling ceiling. The play is shown act by act with the briefest of breaks to move props or for refreshments. The lack of costumes, real props and scenery is soon forgotten.",data/posters/334-vanya-on-42nd-street.jpeg
