id,title,genre,imdb_link,plot,poster_path
372,Reality Bites,"Comedy, Drama, Romance",tt0110950,"In this study of Generation X manners, Lelaina, the valedictorian of her college class, camcords her friends in a mock documentary of posteducation life. Troy is her best friend, a perpetually unemployed musical slacker. Vickie is a manager at the Gap who worries about the results of an AIDS test, while Sammy has problems grappling with his sexuality. When Lelaina meets Michael, an earnest video executive who takes her homemade video to his MTV-like station, she must decide what she values--the materialism of yuppie Michael or the philosophical musings of Troy.",data/posters/372-reality-bites.jpeg
373,Red Rock West,"Crime, Drama, Thriller",tt0105226,"When a promised job for Texan Michael fails to materialise in Wyoming, Mike is mistaken by Wayne to be the hitman he hired to kill his unfaithful wife, Suzanne. Mike takes full advantage of the situation, collects the money and runs. During his getaway, things go wrong, and soon get worse when he runs into the real hitman, Lyle.",data/posters/373-red-rock-west.jpeg
374,Richie Rich,"Comedy, Family",tt0110989,"The richest kid in the world, Richie Rich, has everything he wants, except companionship. While representing his father at a factory opening, he sees some kids playing baseball across the street. Richie wants to join in, but they don't want him around. When a plot to kill the Rich family is devised by Rich Industries' top executive, Laurence Van Dough, Richie must take over control of the company while searching for his lost parents with the help of some new friends.",data/posters/374-richie-rich.jpeg
376,The River Wild,"Adventure, Crime, Thriller",tt0110997,"Gail, an expert at white water rafting, takes her family on a trip down a river on which she used to be a guide. Along the way, the family encounters two men who are unexperienced rafters that need to find their friends down river. Later, the family finds out that the pair of men are armed robbers. The men then physically force the family to take them down the river to meet their accomplices. The rafting trip for the family is definitely ruined, but most importantly, their lives are at stake.",data/posters/376-the-river-wild.jpeg
377,Speed,"Action, Adventure, Thriller",tt0111257,"Bomber terrorist's elevator plan backfires, so he rigs a bomb to a LA city bus. The stipulation is: once armed, the bus must stay above 50 mph to keep from exploding. Also if LAPD Officer tries to unload any passengers off, Payne will detonate it. Joe Morton co-stars as Jack's superior, and Jeff Daniels supports Jack helping him try to defuse the bomb.",data/posters/377-speed.jpeg
378,Speechless,"Comedy, Romance",tt0111256,Two political speechwriters fall in love before they find out they are working for candidates on opposite sides.,data/posters/378-speechless.jpeg
379,Timecop,"Action, Crime, Sci-Fi, Thriller",tt0111438,"When the ability to travel through time is perfected, a new type of law enforcement agency is formed. It's called Time Enforcement Commission or TEC. A cop, Max Walker, is assigned to the group. On the day he was chosen, some men attack him and kill his wife. Ten years later Max is still grieving but has become a good agent for the TEC. He tracks down a former co-worker who went into the past to make money. Max brings him back for sentencing but not after telling Max that Senator McComb, the man in charge of TEC, sent him. Max has his eye on McComb.",data/posters/379-timecop.jpeg
380,True Lies,"Action, Adventure, Comedy, Thriller",tt0111503,"Harry Tasker (Arnold Schwarzenegger) leads a double life. At work he is a government agent with a license to do just about anything, while at home he pretends to be a dull computer salesman. He is on the trail of stolen nuclear weapons that are in the hands of fanatic terrorists when something more important comes up. Harry finds his wife is seeing another man (Bill Paxton) because she needs some adventure in her life. Harry decides to give it to her, juggling pursuit of terrorists on one hand and an adventure for his wife on the other while showing he can Tango all at once.",data/posters/380-true-lies.jpeg
381,When a Man Loves a Woman,"Drama, Romance",tt0111693,The seemingly perfect relationship between a man and his wife is tested as a result of her alcoholism.,data/posters/381-when-a-man-loves-a-woman.jpeg
382,Wolf,"Drama, Horror, Romance, Thriller",tt0111742,"Worn down and out of luck, aging publisher Will Randall is at the end of his rope when a younger co-worker snatches both his job and wife out from under his nose. But after being bitten by a wolf, Will suddenly finds himself energized, more competitive than ever, and possessed with amazingly heightened senses. Meanwhile, the beautiful daughter of his shrewd boss begins to fall for him - without realizing that the man she's begun to love is gradually turning into the creature by which he was bitten.",data/posters/382-wolf.jpeg
383,Wyatt Earp,"Adventure, Biography, Crime, Drama, Western",tt0111756,"From Wichita to Dodge City to the O.K. Corral in Tombstone, a man becomes a myth in this thrilling journey of romance, adventure and desperate, heroic action.",data/posters/383-wyatt-earp.jpeg
384,Bad Company,"Crime, Drama, Thriller",tt0112443,"Nelson Crowe is a CIA operative under the thumb of the Company for a disputed delivery of $50,000 in gold. They blackmail him into working for the Grimes Organization, which is set up as a private company for hire, to blackmail prominent individuals. Crowe, working with Margaret Wells (another former Covert Operations operative), blackmails and bribes a State Supreme Court judge, but the deal sours. One of Crowe's co-workers, Tod Stapp, discovers Crowe's current CIA involvement in a plot to overthrow Grimes, and blackmails him to be cut in on the deal. More blackmail occurs as Wells manipulates Crowe to kill Grimes, then the CIA uses that discovery to blackmail Wells into killing Crowe. Who can you trust???",data/posters/384-bad-company.jpeg
385,A Man of No Importance,"Comedy, Drama",tt0110455,"Alfred Byrne (Albert Finney) is a middle-aged bus conductor in Dublin, Ireland in 1963. He would appear to live a life of quiet desperation: he's gay, but firmly closeted, and his sister is...",data/posters/385-a-man-of-no-importance.jpeg
386,S.F.W.,"Comedy, Drama",tt0111048,"Cliff Spab is a guy who doesn't really care about anything. He gets held hostage at a store for 36 days by terrorists, who demand that the entire thing be broadcast on national television. Cliff ends up taking a bullet for fellow hostage Wendy - making him a national hero. The two are the sole survivors of the ordeal, and soon become prisoners of the media. Cliff escapes it all, only to find himself being pushed further away from Wendy when he needs her most.",data/posters/386-sfw.jpeg
387,A Low Down Dirty Shame,"Action, Comedy, Crime",tt0110399,"A black detective becomes embroiled in a web of danger while searching for a fortune in missing drug money.During the course of his investigation, he encounters various old connections, ultimately confronting the criminal responsible for Shame's expulsion from the force. He must also deal with two women, Angela, a beautiful old flame, and Peaches, his energetic but annoying sidekick.",data/posters/387-a-low-down-dirty-shame.jpeg
388,"Boys Life: Three Stories of Love, Lust, and Liberation",Drama,tt0112570,"Each of the three short films in this collection presents a young gay man at the threshold of adulthood. In ""Pool Days,"" Justin is a 17-year old Bethesda lad, hired as the evening life guard at a fitness center. In the course of the summer, he realizes and embraces that he's gay. In ""A Friend of Dorothy,"" Winston arrives from upstate for his freshman year at NYU. He has to figure out, with some help from Anne, a hometown friend, how to build a social life as a young gay man in the city. In ""The Disco Years,"" Tom looks back on 1978, the year in high school that he came out of the closet after one joyful and several painful encounters.",data/posters/388-boys-life-three-stories-of-love-lust-and-liberation.jpeg
389,Colonel Chabert,"Drama, History, Romance, War",tt0109454,"Colonel Chabert has been severely wounded in the French-Russian Napoleonic war to the point that the medical examiner has signed his death certificate. When he regains his health and memory, he goes back to Paris, where his ""widow"", Anne has married the Count Ferraud and is financing his rise to power using Chabert's money. Chabert hires a lawyer to help him get back his money and his honor.",data/posters/389-colonel-chabert.jpeg
390,"Faster, Pussycat! Kill! Kill!","Action, Comedy",tt0059170,"Three strippers seeking thrills encounter a young couple in the desert. After dispatching the boyfriend, they take the girl hostage and begin scheming on a crippled old man living with his two sons in the desert, reputedly hiding a tidy sum of cash. They become houseguests of the old man and try and seduce the sons in an attempt to locate the money, not realizing that the old man has a few sinister intentions of his own.",data/posters/390-faster-pussycat-kill-kill.jpeg
391,Jason's Lyric,"Crime, Drama, Romance",tt0110186,"The story of a young man, Jason (Allen Payne) who must confront his trauma-induced insecurity about love, as well as a sense of owed responsibility to his mother and troubled brother Joshua (Bokeem Woodbine). Jason, an assistant manager and sales clerk at an electronics store, falls in love with Lyric (Jada Pinkett Smith) and finds happiness, but his family history and mentally ill war veteran father, Maddog (Forest Whitaker) plague his life's plans before he can leave it all for a better life.",data/posters/391-jasons-lyric.jpeg
393,Street Fighter,"Action, Adventure, Comedy, Thriller",tt0111301,"Col. William Guile leads an army of soldiers into the country of Shadaloo to find traces to lead him to General M. Bison, who has captured many people including three missing soldiers. Among them is Carlos ""Charlie"" Blanka, in which Bison decides to turn into a hideous mutant. On the other hand, Chun Li is a reporter who seeks revenge against Bison for the death of her father years ago. Then two small time hustlers Ryu and Ken, are arrested along with Sagat, a powerful arms dealer and Vega for dealing of illegal weapons. Guile recruits them in order to find Bison's base. Now Guile, T. Hawk, Cammy, Ryu, Ken, Chun Li, Balrog and E. Honda have three days before Bison murders the hostages and takes over the world.",data/posters/393-street-fighter.jpeg
405,Highlander: The Final Dimension,"Action, Fantasy, Romance, Sci-Fi",tt0110027,"The third Highlander movie takes place at 1994, which means it's a prequel of the second film. After the death of his beloved wife Heather some centuries ago, Connor MacLeod left the highlands of Scotland and wandered around the world. Finally, he got to Japan, where he met the famous sorcerer Nakano, who was an Immortal too. Soon, they became friends, and Nakano taught Conor some tricks. But one day, an old enemy, Kane, came to Japan willing to find Nakano's cave and kill him. Although he succeeded, after cutting Nakano's head the mountain collapsed and Kane was trapped. Now, centuries after, an excavation reveals Nakano's cave...",data/posters/405-highlander-the-final-dimension.jpeg
406,Federal Hill,"Crime, Drama",tt0109785,"In Providence's Italian neighborhood, Federal Hill, five young men face their choices as they become adults. Bobby, who's sort of dim, owes $30,000 to a counterfeiter who's demanding payment; he asks Ralph, a gifted cat burglar, to help and Ralph comes up with a plan. Later, Frank's dad, who is one of the Hill's top mobsters, wants to have a talk with Ralph about some of this plan. Meanwhile, Ralph's best friend Nicky falls hard for Wendy, a rich blond from Brown, and Nicky begins to imagine a future with her away from Providence. Ralph thinks Nicky's making a big mistake and sets out to prove it. When Ralph insults Frank's dad, things come to a head.",data/posters/406-federal-hill.jpeg
407,In the Mouth of Madness,"Drama, Horror, Mystery, Thriller",tt0113409,"With the disappearance of hack horror writer Sutter Cane, all Hell is breaking loose...literally! Author Cane, it seems, has a knack for description that really brings his evil creepy-crawlies to life. Insurance investigator John Trent is sent to investigate Cane's mysterious vanishing act and ends up in the sleepy little East Coast town of Hobb's End. The fact that this town exists as a figment of Cane's twisted imagination is only the beginning of Trent's problems.",data/posters/407-in-the-mouth-of-madness.jpeg
408,8 Seconds,"Biography, Drama, Sport, Western",tt0109021,"This movie chronicles the life of Lane Frost, 1987 PRCA Bull Riding World Champion, his marriage and his friendships with Tuff Hedeman (three-time World Champion) and Cody Lambert.",data/posters/408-8-seconds.jpeg
409,Above the Rim,"Crime, Drama, Sport, Thriller",tt0109035,"Story of Kyle-Lee Watson, a promising high school basketball star, and his relationships with Birdie, a powerful drug dealer, and Birdie's brother, Thomas 'Shep' Sheppard, himself once a promising high school star at Kyle's school, now employed as a security guard.",data/posters/409-above-the-rim.jpeg
410,Addams Family Values,"Comedy, Fantasy",tt0106220,"When an adorable baby boy is added to the Addams household, Wednesday and Pugsley do not hate the baby, they just aren't necessarily excited about his existence. Ok, yeah they do hate the baby. So Wednesday and Pugsley must get rid of the new addition one way or another. Meanwhile a new nanny is added to the household who overtakes Fester. The Addams must stop the nanny, but how?",data/posters/410-addams-family-values.jpeg
412,The Age of Innocence,"Drama, Romance",tt0106226,"Society scion Newland Archer is engaged to May Welland, but his well-ordered life is upset when he meets May's unconventional cousin, the Countess Olenska. At first, Newland becomes a defender of the Countess, whose separation from her abusive husband makes her a social outcast in the restrictive high society of late-19th Century New York, but he finds in her a companion spirit and they fall in love.",data/posters/412-the-age-of-innocence.jpeg
413,Airheads,"Comedy, Crime, Music",tt0109068,"Three would be rockers Chazz, Rex and Pip, known as The Lone Rangers plan to play their demo on a recording company, but then they're turned down rudely. Then they decide to try the famous rock n' roll radio station, but are not accepted either. Then they decide arm themselves with squirt guns and take the station hostage for not playing their demo. But the three get more than what they have bargained for.",data/posters/413-airheads.jpeg
414,The Air Up There,"Comedy, Family, Sport",tt0109067,"Jimmy Dolan is a college basketball coach who wants a big promotion. To get it, he needs to make a dramatic find. He ends up deep in Africa, hoping to recruit Saleh, a huge basketball prodigy Jimmy glimpsed in a home movie. But Saleh is the chief's son and has responsibilities at home, since the tribe's land is threatened by a mining company with its own hotshot basketball team.",data/posters/414-the-air-up-there.jpeg
415,Another Stakeout,"Comedy, Crime",tt0106292,"Chris and Bill are called upon for their excellent surveillance record to stakeout a lakeside home where a Mafia trial witness is believed to be heading or already hiding. Unlike their earlier _Stakeout_, this time they are accompanied by Gina Garret from the DA's office and her pet rottweiler 'Archie'; their cover, husband and wife with son Bill.",data/posters/415-another-stakeout.jpeg
416,Bad Girls,"Action, Adventure, Romance, Western",tt0109198,"When saloon prostitute Cody Zamora rescues her friend Anita from an abusive customer by killing him, she is sentenced to hang. However, Anita and their two friends Eileen and Lilly rescue Cody and the four make a run for Texas, pursued by Graves and O'Brady, two Pinkerton detectives hired to track them. When Cody withdraws her savings from a Texas bank, the women believe they can now start a new life in Oregon. But Cody's old partner Kid Jarrett takes Cody's money when his gang robs the bank, and so the four so-called ""Honky- Tonk Harlots"" set out to recover the money, with the Pinkertons hot on their trail.",data/posters/416-bad-girls.jpeg
417,Barcelona,"Comedy, Drama, Romance",tt0109219,"Ted, a stuffy white guy from Illinois working in sales for the Barcelona office of a US corporation, is paid an unexpected visit by his somewhat less stuffy cousin Fred, who is an officer in the US Navy. Over the next few months, both their lives are irrevocably altered by the events which follow Fred's arrival, events which are the trivial stuff of a comedy of manners at first but which gradually grow increasingly dramatic.",data/posters/417-barcelona.jpeg
418,Being Human,"Comedy, Drama",tt0106379,"Five bittersweet vignettes that span the entire human history about five different men, all called Hector and played by the same actor (Robin Williams), who find themselves at a critical juncture in their lives. In prehistoric times, Hector lives in peace with his wife and their little son and daughter in a cave on a quite uninhabited island somewhere in the north. His world is shattered when a group of foreign pagan raiders led by a young chieftain and a somewhat pacifistic priest arrive there. In Ancient Rome, Hector is a loyal well-treated slave of Lucinnius, a somewhat naive big trader with political connections. When his latest shipment fails to arrive and the local corrupt governor Cyprion refuses to lend him money for his further endeavors due to bad omen that a professional soothsayer saw while reading the future from a chicken liver, he is ruined. To make things worse, just as Hector plans to ask his master for freedom and elope with his master's female African slave Thalia, Lucinnius informs him that they've been chosen to be scapegoats and must kill themselves under the governor's orders. In medieval times, Hector is a Scotsman who's traveling with a somewhat zealotic but friendly and well-intentioned priest on a mission of mercy to help the fallen crusaders, mortally wounded in the bloody skirmishes, make it to the other side in peace. Beatrice, a nice beautiful flirtatious Italian widow, is traveling part of the way with them as well. Hector is tired of death and carnage and wants to go home but when he and Beatrice connect despite not speaking each-others languages, he falls for her. The priest warns him that he can't handle her needs but Hector doesn't take his friendly warning seriously and eventually leaves with her. However, he soon realizes that the priest was referring to responsibilities of a complicated family life. During the Renaissance, a group of Portuguese nobleman and their servants and soldiers gets shipwrecked somewhere on the coast of Africa. They make an encampment at the beach and try to find some Africans to ask for help but they also try to uphold their strict old ways of life at their beach camp. The realities of the life and death situation they're in kick in quickly and things go wrong for most of them. Hector is one of the lower nobleman, who tries to reconnect with his lover, who wants nothing to do with him. However, Hector's misfortune turns out to be his blessing this time, if only temporarily. In present day New York, Hector is about to pick up his young daughter and little son he hasn't seen in years from his ex wife and her new husband and take them to a seaside bungalow where they can reconnect again. However, his day turns into a quagmire. First he gets blamed by the police for a bizarre accident that almost kills one of the tenants in a building owned by his somewhat sleazy partner Boris. Then Hector borrows the flower delivery car from his nice girlfriend Anna to get the kids but forgets to deliver the flowers which Anna's client ordered for a celebration. His kids don't make things much easier for him either. He decides to treat them like adults for a change and they have a redeeming serious talk about their uneasy relationship.",data/posters/418-being-human.jpeg
419,The Beverly Hillbillies,"Comedy, Family",tt0106400,"Jed Clampett and kin move from Arkansas to Beverly Hills when he becomes a billionaire, after an oil strike. The country folk are very naive with regard to life in the big city, so when Jed starts a search for a new wife there are inevitably plenty of takers and con artists ready to make a fast buck.",data/posters/419-the-beverly-hillbillies.jpeg
420,Beverly Hills Cop III,"Action, Comedy, Crime, Thriller",tt0109254,"In Detroit, Axel Foley leads a raid on a chop shop. When they go in, the people inside start shooting at them. Foley's boss, Inspector Todd, joins them. Someone shoots Todd and before dying Todd tells Foley to get him. Foley tries to catch him but some Feds stop him. They don't tell him why they're letting him get away. Based on things the shooters left behind, leads Foley to believe that the shooters have ties to an amusement park in Beverly Hills. So Foely goes there and asks his old friend, Billy Rosewood who's been promoted to a ""prestigious position"" for help. He meets Billy's new partner, Jon Flint. He asks if they know anyone at the amusement park and Flint tells him he knows the head of security, Ellis DeWald. Foley goes to the park and after a little misadventure, he meets DeWald and recognizes him as the man who killed Todd. But everybody including Flint tells Foley DeWald is a good guy. But Axel knows he's the one. He would be approached a park employee who tries to help him.",data/posters/420-beverly-hills-cop-iii.jpeg
421,Black Beauty,"Adventure, Drama, Family, Romance",tt0109279,"Black Beauty, a beautiful black stallion in 1870s England, recalls his life from his birth through his carefree life as a colt to the many hardships he suffered after achieving maturity. He goes through many owners, both good and bad, until he finally finds happiness and contentment.",data/posters/421-black-beauty.jpeg
422,Blink,"Crime, Drama, Mystery, Thriller",tt0109297,"Emma is an attractive girl in her 20s who has been blind for 20 years. A new type of eye operation partially restores her sight, but she is having problems: sometimes she doesn't ""remember"" what she's seen until later. One night she is awakened by a commotion upstairs. Peering out of her door, she sees a shadowy figure descending the stairs. Convinced that her neighbour has been murdered she approaches the police, only to find that she is unsure if it was just her new eyes playing tricks on her.",data/posters/422-blink.jpeg
423,Blown Away,"Action, Crime, Drama, Thriller",tt0109303,Jimmy Dove works for the bomb squad in Boston and he is always the one who is on the tough jobs. One day he decides to quit the force and to become a teacher for the rookies of the squad. A few days later his former partner is killed by a bomb and Jimmy becomes suspicious that maybe this bomb could have been built by a former friend of himself. He begins to investigate and finds out that his worst nightmare has returned from his past.,data/posters/423-blown-away.jpeg
424,Blue Chips,"Drama, Sport",tt0109305,"Pete Bell, a college basketball coach is under a lot of pressure. His team isn't winning and he cannot attract new players. The stars of the future are secretly being paid by boosters. This practice is forbidden in the college game, but Pete is desperate and has pressures from all around.",data/posters/424-blue-chips.jpeg
425,Blue Sky,"Drama, Romance",tt0109306,"It's the early 1960s. Nuclear engineer Hank Marshall is a major in the US Army, he who works on top secret nuclear testing projects. Trouble follows him from posting to posting largely because of his mentally unstable wife, Carly Marshall, who is bipolar. During her manic phases, her already overt sexuality, which she models after such sex symbols as Marilyn Monroe and Brigitte Bardot, is ratcheted up a notch, that partying behavior which is mixed with less frequent phases of physically destructive behavior. Regardless, Hank and Carly love each other, Hank who would admit to himself that he enjoys the fact that other men find Carly attractive, which is partly why he allows her to act the way she does in public. In turn, they mutually love their now two teenaged daughters, Alex and Becky. Reassigned from their two year posting in Hawaii largely due to the ruckus Carly has caused there, they are next sent to Alabama, the base under the command of Vince Johnson, his wife, Vera Johnson, who heads the wives' welcoming committee. At an age of starting to test her own sexuality, Alex starts to date the Johnsons' son, Glenn. Due to no fault of his own, Hank faces some problems in the latest project on which he is working, code named Blue Sky. And Carly continues her regular behavior, which catches Vince's overtly wandering eye. These items in combination lead to the potential of the Marshalls' home life being pulled apart and Hank's career destroyed, both irreparably.",data/posters/425-blue-sky.jpeg
426,Body Snatchers,"Horror, Sci-Fi",tt0106452,"Family moves to military base for the summer, but the soldiers are behaving even more strangely than usual. Is it a toxic spill as suggested or is it something more sinister?",data/posters/426-body-snatchers.jpeg
427,Boxing Helena,"Drama, Mystery, Romance, Thriller",tt0106471,"A top surgeon is besotted with a beautiful woman who once ditched him. Unable to come to terms with life without her, he tries to convince her that they need each other. She has other ideas, but an horrific accident leaves her at his mercy. The plot is bizarre and perhaps sick at times, ending abruptly and with a twist.",data/posters/427-boxing-helena.jpeg
