id,title,genre,imdb_link,plot,poster_path
154,Belle de Jour,"Drama, Romance",tt0061395,"Severine is a beautiful young woman married to a doctor. She loves her husband dearly, but cannot bring herself to be physically intimate with him. She indulges instead in vivid, kinky, erotic fantasies to entertain her sexual desires. Eventually she becomes a prostitute, working in a brothel in the afternoons while remaining chaste in her marriage.",data/posters/154-belle-de-jour.jpeg
155,Beyond Rangoon,"Action, Adventure, Drama",tt0112495,"Laura is trying to pick up the pieces of her life after the murder of her husband and son, and goes on vacation with her sister to Burma. After losing her passport at a political rally, she is left on her own for a few days, during which time she falls in with students fighting for democracy. She and their leader, U Aung Ko, travel through Burma, whilst witnessing many bloody acts of repression by the dictatorship, in an attempt to escape to Thailand. Based on a true story.",data/posters/155-beyond-rangoon.jpeg
156,Blue in the Face,Comedy,tt0112541,"Wayne Wang's follow-up movie to Smoke presents a series of improvisational situations strung together to form a pastiche of Brooklyn's diverse ethnicity, offbeat humor, and essential humanity. Many of the same characters inhabiting Auggie Wren's Brooklyn Cigar Store in Smoke return here to expound on their philosophy of smoking, relationships, baseball, New York, and Belgian Waffles. Most of all, this is a movie about living life, off-the-cuff.",data/posters/156-blue-in-the-face.jpeg
157,Canadian Bacon,Comedy,tt0109370,"The US economy is in a rut, and so is the president's approval rating. What we need is a good war, but the Russians aren't interested. Hey -- how about that big polite country to the north? Niagara Falls Sheriff Bud B. Boomer takes this all a bit too seriously, though.",data/posters/157-canadian-bacon.jpeg
158,Casper,"Comedy, Family, Fantasy",tt0112642,"Furious that her late father only willed her his gloomy-looking mansion rather than his millions, Carrigan Crittenden is ready to burn the place to the ground when she discovers a map to a treasure hidden in the house. But when she enters the rickety mansion to seek her claim, she is frightened away by a wicked wave of ghosts. Determined to get her hands on this hidden fortune, she hires afterlife therapist Dr. James Harvey to exorcise the ghosts from the mansion. Harvey and his daughter Kat move in, and soon Kat meets Casper, the ghost of a young boy who's ""the friendliest ghost you know."" But not so friendly are Casper's uncles--Stretch, Fatso and Stinkie--who are determined to drive all ""fleshies"" away. Ultimately, it is up to Harvey and Kat to help the ghosts cross over to the other side.",data/posters/158-casper.jpeg
159,Clockers,"Crime, Drama, Mystery",tt0112688,"Strike is a young city drug pusher under the tutelage of drug-lord Rodney Little, who, when not playing with model trains or drinking Moo for his ulcer, just likes to chill with his brothers near the benches outside the project houses. When a night man at a fast-food restaurant is found with four bullets in his body, Strike's older brother turns himself in as the killer. Det. Rocco Klein doesn't buy the story, however, and sets out to find the truth, and it seems that all the fingers point toward Strike & Rodney.",data/posters/159-clockers.jpeg
160,Congo,"Action, Adventure, Mystery, Sci-Fi",tt0112715,"A megalomaniac C.E.O. sends his son into the dangerous African Congo on a quest for a source of diamonds large enough and pure enough to function as powerful laser communications transmitters (or is it laser weapons?). When contact is lost with his son and the team, his sometime daughter- in-law is sent after them. She is a former CIA operative and, accompanied by gee-whiz gadgetry and a few eccentric characters (including a mercenary, a researcher with a talking gorilla, and a a nutty Indiana-Jones-type looking for King Solomon's Mines), sets out to rescue her former fiancé. What they all discover is that often what we most want turns out to be the source of our downfall.",data/posters/160-congo.jpeg
161,Crimson Tide,"Action, Drama, Thriller, War",tt0112740,"When some Russian rebels takes control of some ICBM's, the Americans mobilize. Among the vessels sent is the nuclear sub, the Alabama. But before they leave they need a new X.O. and among the choices is Commander Hunter, who hasn't seen much action. But the ship's Captain, Ramsey OK's him. While on the way, there was an incident and Hunter disagreed with how Ramsey handled it, it's evident that Ramsey doesn't think much of Hunter because Hunter was college educated while Ramsey worked his way up. They're given orders to attack but when they were in the process of receiving another order, the ship's communications were damaged, so the entire message was not received. Ramsey decides to continue with their previous order while Hunter wants to reestablish contact first. That's when the two men butt heads that ends with Hunter relieving Ramsey. Later when some men die, some of the officers feel that Hunter is not up to the task so they team up to retake control. But Hunter has taken precautions.",data/posters/161-crimson-tide.jpeg
162,Crumb,"Documentary, Biography, Comedy, Drama",tt0109508,"This movie chronicles the life and times of R. Crumb. Robert Crumb is the cartoonist/artist who drew Keep On Truckin', Fritz the Cat, and played a major pioneering role in the genesis of underground comix. Through interviews with his mother, two brothers, wife, and ex-girlfriends, as well as selections from his vast quantity of graphic art, we are treated to a darkly comic ride through one man's subconscious mind. As stream-of-consciousness images incessantly flow forth from the tip of his pen, biting social satire is revealed, often along with a disturbing and haunting vision of Crumb's own betes noires and inadequacies. As his acid-trip induced images flicker across our own retinas, we gain a little insight into this complex and highly creative individual.",data/posters/162-crumb.jpeg
163,Desperado,"Action, Crime, Thriller",tt0112851,"With this sequel to his prize-winning independent previous film, ""El Mariachi,"" director Robert Rodriquez joins the ranks of Sam Peckinpah and John Woo as a master of slick, glamorized ultra-violence. We pick up the story as a continuation of ""El Mariachi,"" where an itinerant musician, looking for work, gets mistaken for a hitman and thereby entangled in a web of love, corruption, and death. This time, he is out to avenge the murder of his lover and the maiming of his fretting hand, which occurred at the end of the earlier movie. However, the plot is recapitulated, and again, a case of mistaken identity leads to a very high body count, involvement with a beautiful woman who works for the local drug lord, and finally, the inevitable face-to-face confrontation and bloody showdown.",data/posters/163-desperado.jpeg
164,Devil in a Blue Dress,"Crime, Drama, Mystery, Thriller",tt0112857,"It is 1948 in LA and Ezikeal ""Easy"" Rawlins, an African-American World War II veteran, is looking for work. At his friend's bar, he is introduced to a white man, DeWitt Albright, who is looking for someone to help him find a missing white woman assumed to be hiding somewhere in LA's Black community. This woman, Daphane Monet, happens to be the fiancée of a wealthy ""blue blood,"" Todd Carter, who is currently the favorite in the city's mayoralty race. Daphane Monet is known to frequent the Black jazz clubs in LA. Easy, innocently, accepts Albright's offer; however, he quickly finds himself amidst murder, crooked cops, ruthless politicians, and brutalizing hoodlums. This is a Chandler-esque ""who-done-it"" with an African-American theme.",data/posters/164-devil-in-a-blue-dress.jpeg
165,Die Hard with a Vengeance,"Action, Adventure, Thriller",tt0112864,"John McClane is now almost a full-blown alcoholic and is suspended from the NYPD. But when a bomb goes off in the Bonwit Teller Department Store the police go insane trying to figure out what's going on. Soon, a man named Simon calls and asks for McClane. Simon tells Inspector Walter Cobb that McClane is going to play a game called ""Simon Says"". He says that McClane is going to do the tasks he assigns him. If not, he'll set off another bomb. With the help of a Harlem electrician, John McClane must race all over New York trying to figure out the frustrating puzzles that the crafty terrorist gives him. But when a bomb goes off in a subway station right by the Federal Reserve (the biggest gold storage in the world) things start to get heated.",data/posters/165-die-hard-with-a-vengeance.jpeg
166,The Doom Generation,"Comedy, Crime, Drama",tt0112887,"Jordan White and Amy Blue, two troubled teens, pick up an adolescent drifter, Xavier Red. Together, the threesome embark on a sex-and-violence-filled journey through an America of psychos and quickie marts.",data/posters/166-the-doom-generation.jpeg
168,First Knight,"Action, Adventure, Drama, Romance",tt0113071,"Lancelot lives by the sword. In fact, they're next door neighbours, so teaming up to fight for money comes pretty naturally. Lady Guinevere, on her way to marry King Arthur is ambushed by the evil Sir Malagant. Fortunately Lancelot is lurking nearby and he rescues his future queen. They fall in love, but Guinevere still fancies the idea of wearing a crown, so she honours her promise to Arthur. Can Lady Guinevere remain faithful, or will this Pretty Woman become a lady of the knight?",data/posters/168-first-knight.jpeg
169,Free Willy 2: The Adventure Home,"Adventure, Drama, Family",tt0113114,"Willy the smart and rebellious whale and Jessie the orphaned boy team up to escape Willy's captivity and horrible owner to get back to his pod. Can they succeed with the help of Annie and Glenn Jessie's foster parents, Randolph the spiritual friend of Willy and Jessie, and Rae Willy's trainer?",data/posters/169-free-willy-2-the-adventure-home.jpeg
170,Hackers,"Comedy, Crime, Drama, Thriller",tt0113243,Dade Murphy was a hacker even as a kid in Seattle. He got arrested for the computer virus that he planted and was banned from using any computer until the age of 18.Then he moves to New York to meet a group of hackers. He also falls in love with Kate Libby.,data/posters/170-hackers.jpeg
171,Jeffrey,"Comedy, Drama",tt0113464,"Jeffrey, a young gay man in New York, decides that sex is too much and decides to become celibate. He immediately meets the man of his dreams and must decide whether or not love is worth the danger of a boyfriend dying.",data/posters/171-jeffrey.jpeg
172,Johnny Mnemonic,"Action, Drama, Sci-Fi, Thriller",tt0113481,"In 2021, the whole world is connected by the gigantic Internet, and almost a half of the population is suffering from the Nerve Attenuation Syndrome (NAS).Johnny with an inplanted memory chip in his brain was ordered to transport the over loaded information from Beijing to Newark. While Pharmakom Industries supported by yakuza tries to capture him to get the informaiton back, the Low-tech group led by J-Bone tries to break the missing code to download the cure of NAS which Johnny carries.",data/posters/172-johnny-mnemonic.jpeg
173,Judge Dredd,"Action, Crime, Sci-Fi, Thriller",tt0113492,"In the year 2139, the Earth has changed into a virtually uninhabitable place called the Cursed Earth. All of the Earth's population have crowded into the cities across the planet, now known as Mega-Cities. The crimes in these Mega-Cities became so violent and so powerful, that the regular justice system was powerless to contain, then it collapsed completely. However, a new justice system came from the ashes, there were three justice systems in one (police, jury and executioner), they were called Judges. In Mega-City One (formerly, New York City), there was a Judge, named Joseph Dredd, who was the toughest and most stringent Judge in history. One day, he was charged with murder, and was tried and sentenced to life in prison because of it.",data/posters/173-judge-dredd.jpeg
174,Jury Duty,Comedy,tt0113500,"When jobless Tommy Collins discovers that sequestered jurors earn free room and board as well as $5-a-day, he gets himself assigned to a jury in a murder trial. Once there, he does everything he can to prolong the trial and deliberations and make the sequestration more comfortable for himself.",data/posters/174-jury-duty.jpeg
175,Kids,Drama,tt0113540,"Disturbing, dark, low-budget independent film about teen-agers in New York City. The story focuses on Telly (Leo Fitzpatrick), a teen who has a goal to de-flower as many virgins as he can. When one of his old encounters discovers that she is H.I.V.-positive, after only one encounter with a guy, Telly remains undaunted.",data/posters/175-kids.jpeg
176,Living in Oblivion,"Comedy, Drama",tt0113677,This ultimate tribute to all independent filmmakers takes place during one day on the set of a non-budget movie.,data/posters/176-living-in-oblivion.jpeg
177,Lord of Illusions,"Horror, Mystery, Thriller",tt0113690,"During a routine case in L.A., NY private investigator Harry D'Amour stumbles over members of a fanatic cult, who are waiting for the resurrection of their leader Nix. 13 years ago, Nix was gunned down by his best trainee Swann. In the meantime Swann is advanced to a popular illusionist like David Copperfield and is married to the charming Dorothea. She hires D'Amour to protect Swann against the evil cult members. A short time later Swann is killed by one of his own tricks and the occurrences are turning over, and it crackles between Dorothea and D'Amour.",data/posters/177-lord-of-illusions.jpeg
178,Love & Human Remains,"Drama, Comedy",tt0107447,"Set in a dreary urban landscape of Edmonton, LOVE AND HUMAN REMAINS is a dark comedy about a group of twentysomethings looking for love and meaning in the '90s. The film focuses on roommates David, a gay waiter who has has given up on his acting career, and Candy, a book reviewer who is also David's ex-lover. David and Candy's lives are entangled with those of David's friends (a busboy, a psychic dominatrix, and a misogynistic civil-servant) and Candy's dates (a male bartender and a lesbian schoolteacher). Meanwhile, a serial killer menaces the concrete and asphalt neighbourhood in which David and Candy live.",data/posters/178-love--human-remains.jpeg
179,Mad Love,"Comedy, Drama, Romance",tt0113729,"The high-school student Matt Leland lives with his twin brother and sister and his father in a house by the lake. When the teenager Casey Roberts moves to the house on the other side of the lake, Matt snoops into her room with his telescope. They meet each other and soon they fall in love with each other. One day, Matt is taking a test at school and Casey activates the fire alarm to stop the test. She is suspended and her father decides to check her into a psychiatric institution. However Matt breaks her out of the hospital. They travel in Matt's car and have lots of fun until the day Matt discovers that Casey has bipolar disorder with periods of depression and periods of elevated mood. When she tries to commit suicide, Matt realizes that she needs specialized help.",data/posters/179-mad-love.jpeg
180,Mallrats,"Comedy, Romance",tt0113749,"Brodie Bruce, a Sega and comic book obsessed college student, and his best friend, TS Quint, are both dumped by their girlfriends on the same day, and to deal with their loss, they both go to the local mall. Along the way, they meet up with some friends, including Willam, a guy who stares at Magic Eye pictures, desprately trying to see the hidden image; Gwen, one of TS's ex-girlfriends; and Jay & Silent Bob, of Clerks fame. Eventually, they decide to try and win back their significant others, and take care of their respective nemesises (TS's girlfriend's father, and a store clerk who hates the two for not having any shopping agenda).",data/posters/180-mallrats.jpeg
181,Mighty Morphin Power Rangers: The Movie,"Action, Adventure, Family, Sci-Fi, Thriller",tt0113820,"Six teenagers Tommy, Kimberly, Adam, Billy, Rocky and Aisha have discovered the power to fight the forces of evil. A giant egg is unearthed in Angel Grove. Lord Zedd and Rita Repulsa investigate the egg, and release the creature inside - Ivan Ooze, whom Zordon had trapped him inside the egg six thousand years ago. Once released, Ooze left to seek revenge on Zordon. And now Zordon in his crystalline deathbed is dying because he has no power, without the power then Zordon of Eltar will never existed. Now the fate of the universe is in their hands. But this time the Power Rangers head for a distant planet to meet up with a bikini-clad warrior babe named Dulcea who imparts ancient wisdom and power. But now that they have their powers back and becomes Power Rangers once more they will now get back to business and defeat Ivan Ooze at all costs.",data/posters/181-mighty-morphin-power-rangers-the-movie.jpeg
183,Mute Witness,"Crime, Thriller",tt0110604,"Billy Hughes, a mute makeup artist working on a slasher film being shot in Moscow, is locked in the studio after hours. While there she witnesses a brutal murder, and must first escape capture at that time, then keep from being killed before convincing authorities of what she's seen. Plot twists galore follow as Billy tries to stay alive.",data/posters/183-mute-witness.jpeg
184,Nadja,"Drama, Horror",tt0110620,"This ultra-hip, post-modern vampire tale is set in contemporary New York City. Members of a dysfunctional family of vampires are trying to come to terms with each other, in the wake of their father's death. Meanwhile, they are being hunted by Dr. Van Helsing and his hapless nephew. As in all good vampire movies, forces of love are pitted against forces of destruction.",data/posters/184-nadja.jpeg
185,The Net,"Action, Crime, Drama, Mystery, Thriller",tt0113957,"Angela Bennett's a software engineer type who works from home and has few friends outside of cyberspace. Taking her first vacation in years, she becomes embroiled in a web of computer espionage.",data/posters/185-the-net.jpeg
186,Nine Months,"Comedy, Romance",tt0113986,"Samuels life is perfect. That is, until he finds out his girlfriend is pregnant. Now he must face the issues that come with being an expecting father, in a most entertaining way.",data/posters/186-nine-months.jpeg
187,Party Girl,Comedy,tt0114095,"Party girl Mary gets bailed out of jail by her librarian godmother. She starts working at the library, slowly fills her empty brain.",data/posters/187-party-girl.jpeg
188,The Prophecy,"Action, Crime, Drama, Fantasy, Horror, Mystery, Thriller",tt0114194,"""Some people lose their faith because Heaven shows them too little,"" says Thomas Daggett. ""But how many people lose their faith because Heaven showed them too much?"" Daggett nearly became a priest; now he's a cop. He may want to put religion behind him, but one morning a weird, eyeless, hermaphroditic corpse turns up. Suddenly he is on a path that will put him right in the middle of a war in Heaven. And once again, Heaven will show him too much: gore, blood, charred flesh, living corpses and much worse. Even more central to the heavenly war effort is a young girl. This American Indian child has something Gabriel wants. And Gabriel is willing to kill her and anyone in his path - or even reanimate a corpse or two - to get it.",data/posters/188-the-prophecy.jpeg
189,Reckless,"Comedy, Drama, Fantasy",tt0114241,"On Christmas Eve, a regretful husband admits to his high-spirited wife that he has hired a contract killer to take her out. She immediately flees. A nice couple offers her shelter, but everyone have dark secrets in this wacky movie.",data/posters/189-reckless.jpeg
190,Safe,Drama,tt0114323,"""Safe"" has been described as a horror movie of the soul, a description that director Todd Haynes relishes. California housewife Carol White seems to have it all in life: a wealthy husband, a beautiful house, servants, beauty, and a lot of friends. The only thing she lacks is a strong personality: Carol seems timid and empty during all of her interactions with the world around her. At the beginning of the film, one would consider her to be more safe in life than just about anyone. That doesn't turn out to be the case. Starting with headaches and leading to a grandmal seizure, Carol becomes more and more sick, claiming that she's become sensitive to the common toxins in today's world: exhaust, fumes, aerosol spray, etc. She pulls back from the sexual advances of her husband and spends her nights alone by the TV or wandering around the outside of her well-protected home like an animal in a cage. Her physician examines her and can find nothing wrong. An allergist finds that she has an allergic reaction to milk but explains that there is no treatment for that sort of allergy. She sees a psychiatrist who does nothing but make her nervous. In the hospital, Carol sees an infomercial for Wrenwood, a new-age retreat for those who are ""environmentally ill,"" and leaves her husband and stepson to try and find salvation at this retreat: headed by a phony, grandstanding, ""sensitive"" individual named Peter Dunning.",data/posters/190-safe.jpeg
191,The Scarlet Letter,"Drama, Romance",tt0114345,"In 1666 in the Massachusetts Bay colony, Puritans and Algonquian have an uneasy truce. Hester arrives from England, seeking independence. Awaiting her husband, she establishes independence, fixing up a house, befriending Quakers and other outsiders. Passion draws her to a young pastor. He feels the same; when they learn her husband has probably died at the hands of Indians, they consummate their love. A child is born, and on the day Hester is publicly humiliated and made to wear a scarlet letter, her husband appears after a year with Indians. Calling himself Chillingworth, he seeks revenge, searching out Hester's lover and stirring fears of witchcraft. Will his murderous plot succeed?",data/posters/191-the-scarlet-letter.jpeg
193,Showgirls,Drama,tt0114436,"Nomi Malone, a mysterious young girl with the ambition to dance embarks on a journey to Las Vegas to become a showgirl in a high-class hotel show. There she meets Molly, a seamstress at the Stardust Hotel and the two quickly become good friends. She gets a job as a lap dancer at the seedy Cheetah Club but after a chance meeting with Cristal Connors, the star of Goddess, the current show at the hotel where Molly works, Nomi manages to secure an audition for a spot on the chorus line.However she soon realises that fame comes with a price as her friendships, her morals and her soul are put to the test as she works her way up the ladder and eventually becomes the star of the show, stealing Cristal's part. She begins to wonder if all of her work was for nothing and if she can reclaim her life back before it is too late.",data/posters/193-showgirls.jpeg
194,Smoke,"Comedy, Drama",tt0114478,"The plot of this movie, like smoke itself, drifts and swirls ethereally. Characters and subplots are deftly woven into a tapestry of stories and pictures which only slowly emerges to our view. This film tries to convince us that reality doesn't matter so much as aesthetic satisfaction. In Auggie's New York smoke shop, day by day passes, seemingly unchanging until he teaches us to notice the little details of life. Paul Benjamin, a disheartened and broken writer, has a brush with death that is pivotal and sets up an unlikely series of events that afford him a novel glimpse into the life on the street which he saw, but did not truly perceive, every day. Finally, it's Auggie's turn to spin a tale....",data/posters/194-smoke.jpeg
195,Something to Talk About,"Comedy, Drama, Romance",tt0114496,"Grace Bichon, who is managing her father's riding-stable, discovers that her husband Eddie deceives her with another woman. After confronting him in the middle of the night on the streets of their small home town, she decides to stay at her sister Emma Rae's house for a while, to make up her mind. Breaking out of her everyday life, she starts to question the authority of everyone, especially her father's, thus causing a stir in her parent's marriage, too.",data/posters/195-something-to-talk-about.jpeg
196,Species,"Action, Horror, Sci-Fi, Thriller",tt0114508,"In 1993, the Search for Extra Terrestrial Intelligence Project receives a transmission detailing an alien DNA structure, along with instructions on how to splice it with human DNA. The result is Sil, a sensual but deadly creature who can change from a beautiful woman to an armour-plated killing machine in the blink of an eye. Government agent Xavier Fitch assembles a team of scientists and mercenaries to locate and destroy Sil before she manages to find a mate and breed.",data/posters/196-species.jpeg
198,Strange Days,"Action, Crime, Drama, Sci-Fi, Thriller",tt0114558,"Set in the year 1999 during the last days of the old millennium, the movie tells the story of Lenny Nero, an ex-cop who now deals with data-discs containing recorded memories and emotions. One day he receives a disc which contains the memories of a murderer killing a prostitute. Lenny investigates and is pulled deeper and deeper in a whirl of blackmail, murder and rape. Will he survive and solve the case?",data/posters/198-strange-days.jpeg
